[
  {
    "id": "7f8a9b2c-3d4e-5f6a-7b8c-9d0e1f2a3b4c",
    "content": "Patient presents with acute shortness of breath and wheezing. Expiratory wheezes audible bilaterally. Heart rate 124 bpm, SpO2 89% on room air.",
    "timestamp": "2026-09-26T14:15:00Z",
    "source": "CLINICIAN_ENTRY",
    "device_id": "edge_node_ryzen5_042",
    "category": "SYMPTOM",
    "confidence": 0.95,
    "importance": 0.88,
    "recurrence": 1,
    "freshness": 1.0,
    "privacy_level": "SENSITIVE",
    "provenance": {
      "origin_device_id": "edge_node_ryzen5_042",
      "created_at": "2026-09-26T14:15:00Z",
      "generator_modality": "CLINICIAN_ENTRY",
      "parent_memory_ids": [],
      "source_document_hash": "e3b0c44298fc1c149afbf4c8996fb92427ae41e4649b934ca495991b7852b855",
      "revision_count": 0
    },
    "entities": ["patient_synthetic_104", "cond_asthma"],
    "relations": [
      {
        "relation_type": "HAS_CONDITION",
        "target_id": "cond_asthma"
      }
    ],
    "lifecycle_state": "LOCAL",
    "sync_state": "PENDING",
    "version": 1
  },
  {
    "id": "1a2b3c4d-5e6f-7a8b-9c0d-1e2f3a4b5c6d",
    "content": "Severe documented anaphylactic reaction to Penicillin and Cephalosporin class beta-lactams. Strict contraindication.",
    "timestamp": "2024-03-12T09:00:00Z",
    "source": "LAB_REPORT",
    "device_id": "edge_node_ryzen5_042",
    "category": "ALLERGY",
    "confidence": 0.99,
    "importance": 1.0,
    "recurrence": 3,
    "freshness": 1.0,
    "privacy_level": "SENSITIVE",
    "provenance": {
      "origin_device_id": "hospital_central_server",
      "created_at": "2024-03-12T09:00:00Z",
      "generator_modality": "LAB_REPORT",
      "parent_memory_ids": [],
      "source_document_hash": "c5b2...9f01",
      "revision_count": 0
    },
    "entities": ["patient_synthetic_101", "drug_penicillin"],
    "relations": [
      {
        "relation_type": "CONTRAINDICATED_WITH",
        "target_id": "drug_penicillin"
      }
    ],
    "lifecycle_state": "LOCAL",
    "sync_state": "COMMITTED",
    "version": 1
  }
]
